[
  {"moment_id": "M001-MO03", "persona_key": "analyst.en.none.t1.d2.-.-", "lang": "en",
   "sentences": [
     {"text": "Kestrel Town's number 9 headed in a 0.21 xG chance under pressure.", "evidence_ids": ["ev1", "ev3"]},
     {"text": "Their win probability rose by 20 percentage points.", "evidence_ids": ["ev2"]}
   ],
   "verified": true, "verifier_notes": [], "degraded": false},
  {"moment_id": "M001-MO03", "persona_key": "casual.hi.cricket.t1.d0.-.-", "lang": "hi",
   "sentences": [
     {"text": "केस्ट्रल टाउन ने हेडर से गोल किया।", "evidence_ids": ["ev3"], "en_text": "Kestrel Town scored with a header."}
   ],
   "verified": false, "verifier_notes": ["regenerated twice; template fallback used"], "degraded": true}
]
